<?xml version='1.0' encoding='UTF-8'?>
<config xmlns:xsi="http://www.w3.org/2001/XMLSchema-instance" xsi:noNamespaceSchemaLocation="config.xsd">
  <library>library.xml</library>
  <schema>library.xsd</schema>
  <types>
    <type>book</type>
    <type>game</type>
    <type>music</type>
    <type>video</type>
  </types>
</config>
